film_id,title,description,language_id,original_language_id
201,CYCLONE FAMILY,A Lacklusture Drama of a Student And a Monkey who must Sink a Womanizer in A MySQL Convention,1,
202,DADDY PITTSBURGH,A Epic Story of a A Shark And a Student who must Confront a Explorer in The Gulf of Mexico,1,
203,DAISY MENAGERIE,A Fast-Paced Saga of a Pastry Chef And a Monkey who must Sink a Composer in Ancient India,1,
204,DALMATIONS SWEDEN,A Emotional Epistle of a Moose And a Hunter who must Overcome a Robot in A Manhattan Penthouse,1,
205,DANCES NONE,A Insightful Reflection of a A Shark And a Dog who must Kill a Butler in An Abandoned Amusement Park,1,
206,DANCING FEVER,A Stunning Story of a Explorer And a Forensic Psychologist who must Face a Crocodile in A Shark Tank,1,
207,DANGEROUS UPTOWN,A Unbelieveable Story of a Mad Scientist And a Woman who must Overcome a Dog in California,1,
208,DARES PLUTO,A Fateful Story of a Robot And a Dentist who must Defeat a Astronaut in New Orleans,1,
209,DARKNESS WAR,A Touching Documentary of a Husband And a Hunter who must Escape a Boy in The Sahara Desert,1,
210,DARKO DORADO,A Stunning Reflection of a Frisbee And a Husband who must Redeem a Dog in New Orleans,1,
211,DARLING BREAKING,A Brilliant Documentary of a Astronaut And a Squirrel who must Succumb a Student in The Gulf of Mexico,1,
212,DARN FORRESTER,A Fateful Story of a A Shark And a Explorer who must Succumb a Technical Writer in A Jet Boat,1,
213,DATE SPEED,A Touching Saga of a Composer And a Moose who must Discover a Dentist in A MySQL Convention,1,
214,DAUGHTER MADIGAN,A Beautiful Tale of a Hunter And a Mad Scientist who must Confront a Squirrel in The First Manned Space Station,1,
215,DAWN POND,A Thoughtful Documentary of a Dentist And a Forensic Psychologist who must Defeat a Waitress in Berlin,1,
216,DAY UNFAITHFUL,A Stunning Documentary of a Composer And a Mad Scientist who must Find a Technical Writer in A U-Boat,1,
217,DAZED PUNK,A Action-Packed Story of a Pioneer And a Technical Writer who must Discover a Forensic Psychologist in An Abandoned Amusement Park,1,
218,DECEIVER BETRAYED,A Taut Story of a Moose And a Squirrel who must Build a Husband in Ancient India,1,
219,DEEP CRUSADE,A Amazing Tale of a Crocodile And a Squirrel who must Discover a Composer in Australia,1,
220,DEER VIRGINIAN,A Thoughtful Story of a Mad Cow And a Womanizer who must Overcome a Mad Scientist in Soviet Georgia,1,
221,DELIVERANCE MULHOLLAND,A Astounding Saga of a Monkey And a Moose who must Conquer a Butler in A Shark Tank,1,
222,DESERT POSEIDON,A Brilliant Documentary of a Butler And a Frisbee who must Build a Astronaut in New Orleans,1,
223,DESIRE ALIEN,A Fast-Paced Tale of a Dog And a Forensic Psychologist who must Meet a Astronaut in The First Manned Space Station,1,
224,DESPERATE TRAINSPOTTING,A Epic Yarn of a Forensic Psychologist And a Teacher who must Face a Lumberjack in California,1,
225,DESTINATION JERK,A Beautiful Yarn of a Teacher And a Cat who must Build a Car in A U-Boat,1,
226,DESTINY SATURDAY,A Touching Drama of a Crocodile And a Crocodile who must Conquer a Explorer in Soviet Georgia,1,
227,DETAILS PACKER,A Epic Saga of a Waitress And a Composer who must Face a Boat in A U-Boat,1,
228,DETECTIVE VISION,A Fanciful Documentary of a Pioneer And a Woman who must Redeem a Hunter in Ancient Japan,1,
229,DEVIL DESIRE,A Beautiful Reflection of a Monkey And a Dentist who must Face a Database Administrator in Ancient Japan,1,
230,DIARY PANIC,A Thoughtful Character Study of a Frisbee And a Mad Cow who must Outgun a Man in Ancient India,1,
231,DINOSAUR SECRETARY,A Action-Packed Drama of a Feminist And a Girl who must Reach a Robot in The Canadian Rockies,1,
232,DIRTY ACE,A Action-Packed Character Study of a Forensic Psychologist And a Girl who must Build a Dentist in The Outback,1,
233,DISCIPLE MOTHER,A Touching Reflection of a Mad Scientist And a Boat who must Face a Moose in A Shark Tank,1,
234,DISTURBING SCARFACE,A Lacklusture Display of a Crocodile And a Butler who must Overcome a Monkey in A U-Boat,1,
235,DIVIDE MONSTER,A Intrepid Saga of a Man And a Forensic Psychologist who must Reach a Squirrel in A Monastery,1,
236,DIVINE RESURRECTION,A Boring Character Study of a Man And a Womanizer who must Succumb a Teacher in An Abandoned Amusement Park,1,
237,DIVORCE SHINING,A Unbelieveable Saga of a Crocodile And a Student who must Discover a Cat in Ancient India,1,
238,DOCTOR GRAIL,A Insightful Drama of a Womanizer And a Waitress who must Reach a Forensic Psychologist in The Outback,1,
239,DOGMA FAMILY,A Brilliant Character Study of a Database Administrator And a Monkey who must Succumb a Astronaut in New Orleans,1,
240,DOLLS RAGE,A Thrilling Display of a Pioneer And a Frisbee who must Escape a Teacher in The Outback,1,
241,DONNIE ALLEY,A Awe-Inspiring Tale of a Butler And a Frisbee who must Vanquish a Teacher in Ancient Japan,1,
242,DOOM DANCING,A Astounding Panorama of a Car And a Mad Scientist who must Battle a Lumberjack in A MySQL Convention,1,
243,DOORS PRESIDENT,A Awe-Inspiring Display of a Squirrel And a Woman who must Overcome a Boy in The Gulf of Mexico,1,
244,DORADO NOTTING,A Action-Packed Tale of a Sumo Wrestler And a A Shark who must Meet a Frisbee in California,1,
245,DOUBLE WRATH,A Thoughtful Yarn of a Womanizer And a Dog who must Challenge a Madman in The Gulf of Mexico,1,
246,DOUBTFIRE LABYRINTH,A Intrepid Panorama of a Butler And a Composer who must Meet a Mad Cow in The Sahara Desert,1,
247,DOWNHILL ENOUGH,A Emotional Tale of a Pastry Chef And a Forensic Psychologist who must Succumb a Monkey in The Sahara Desert,1,
248,DOZEN LION,A Taut Drama of a Cat And a Girl who must Defeat a Frisbee in The Canadian Rockies,1,
249,DRACULA CRYSTAL,A Thrilling Reflection of a Feminist And a Cat who must Find a Frisbee in An Abandoned Fun House,1,
250,DRAGON SQUAD,A Taut Reflection of a Boy And a Waitress who must Outgun a Teacher in Ancient China,1,
251,DRAGONFLY STRANGERS,A Boring Documentary of a Pioneer And a Man who must Vanquish a Man in Nigeria,1,
252,DREAM PICKUP,A Epic Display of a Car And a Composer who must Overcome a Forensic Psychologist in The Gulf of Mexico,1,
253,DRIFTER COMMANDMENTS,A Epic Reflection of a Womanizer And a Squirrel who must Discover a Husband in A Jet Boat,1,
254,DRIVER ANNIE,A Lacklusture Character Study of a Butler And a Car who must Redeem a Boat in An Abandoned Fun House,1,
255,DRIVING POLISH,A Action-Packed Yarn of a Feminist And a Technical Writer who must Sink a Boat in An Abandoned Mine Shaft,1,
256,DROP WATERFRONT,A Fanciful Documentary of a Husband And a Explorer who must Reach a Madman in Ancient China,1,
257,DRUMLINE CYCLONE,A Insightful Panorama of a Monkey And a Sumo Wrestler who must Outrace a Mad Scientist in The Canadian Rockies,1,
258,DRUMS DYNAMITE,A Epic Display of a Crocodile And a Crocodile who must Confront a Dog in An Abandoned Amusement Park,1,
259,DUCK RACER,A Lacklusture Yarn of a Teacher And a Squirrel who must Overcome a Dog in A Shark Tank,1,
260,DUDE BLINDNESS,A Stunning Reflection of a Husband And a Lumberjack who must Face a Frisbee in An Abandoned Fun House,1,
261,DUFFEL APOCALYPSE,A Emotional Display of a Boat And a Explorer who must Challenge a Madman in A MySQL Convention,1,
262,DUMBO LUST,A Touching Display of a Feminist And a Dentist who must Conquer a Husband in The Gulf of Mexico,1,
263,DURHAM PANKY,A Brilliant Panorama of a Girl And a Boy who must Face a Mad Scientist in An Abandoned Mine Shaft,1,
264,DWARFS ALTER,A Emotional Yarn of a Girl And a Dog who must Challenge a Composer in Ancient Japan,1,
265,DYING MAKER,A Intrepid Tale of a Boat And a Monkey who must Kill a Cat in California,1,
266,DYNAMITE TARZAN,A Intrepid Documentary of a Forensic Psychologist And a Mad Scientist who must Face a Explorer in A U-Boat,1,
267,EAGLES PANKY,A Thoughtful Story of a Car And a Boy who must Find a A Shark in The Sahara Desert,1,
268,EARLY HOME,A Amazing Panorama of a Mad Scientist And a Husband who must Meet a Woman in The Outback,1,
269,EARRING INSTINCT,A Stunning Character Study of a Dentist And a Mad Cow who must Find a Teacher in Nigeria,1,
270,EARTH VISION,A Stunning Drama of a Butler And a Madman who must Outrace a Womanizer in Ancient India,1,
271,EASY GLADIATOR,A Fateful Story of a Monkey And a Girl who must Overcome a Pastry Chef in Ancient India,1,
272,EDGE KISSING,A Beautiful Yarn of a Composer And a Mad Cow who must Redeem a Mad Scientist in A Jet Boat,1,
273,EFFECT GLADIATOR,A Beautiful Display of a Pastry Chef And a Pastry Chef who must Outgun a Forensic Psychologist in A Manhattan Penthouse,1,
274,EGG IGBY,A Beautiful Documentary of a Boat And a Sumo Wrestler who must Succumb a Database Administrator in The First Manned Space Station,1,
275,EGYPT TENENBAUMS,A Intrepid Story of a Madman And a Secret Agent who must Outrace a Astronaut in An Abandoned Amusement Park,1,
276,ELEMENT FREDDY,A Awe-Inspiring Reflection of a Waitress And a Squirrel who must Kill a Mad Cow in A Jet Boat,1,
277,ELEPHANT TROJAN,A Beautiful Panorama of a Lumberjack And a Forensic Psychologist who must Overcome a Frisbee in A Baloon,1,
278,ELF MURDER,A Action-Packed Story of a Frisbee And a Woman who must Reach a Girl in An Abandoned Mine Shaft,1,
279,ELIZABETH SHANE,A Lacklusture Display of a Womanizer And a Dog who must Face a Sumo Wrestler in Ancient Japan,1,
280,EMPIRE MALKOVICH,A Amazing Story of a Feminist And a Cat who must Face a Car in An Abandoned Fun House,1,
281,ENCINO ELF,A Astounding Drama of a Feminist And a Teacher who must Confront a Husband in A Baloon,1,
282,ENCOUNTERS CURTAIN,A Insightful Epistle of a Pastry Chef And a Womanizer who must Build a Boat in New Orleans,1,
283,ENDING CROWDS,A Unbelieveable Display of a Dentist And a Madman who must Vanquish a Squirrel in Berlin,1,
284,ENEMY ODDS,A Fanciful Panorama of a Mad Scientist And a Woman who must Pursue a Astronaut in Ancient India,1,
285,ENGLISH BULWORTH,A Intrepid Epistle of a Pastry Chef And a Pastry Chef who must Pursue a Crocodile in Ancient China,1,
286,ENOUGH RAGING,A Astounding Character Study of a Boat And a Secret Agent who must Find a Mad Cow in The Sahara Desert,1,
287,ENTRAPMENT SATISFACTION,A Thoughtful Panorama of a Hunter And a Teacher who must Reach a Mad Cow in A U-Boat,1,
288,ESCAPE METROPOLIS,A Taut Yarn of a Astronaut And a Technical Writer who must Outgun a Boat in New Orleans,1,
289,EVE RESURRECTION,A Awe-Inspiring Yarn of a Pastry Chef And a Database Administrator who must Challenge a Teacher in A Baloon,1,
290,EVERYONE CRAFT,A Fateful Display of a Waitress And a Dentist who must Reach a Butler in Nigeria,1,
291,EVOLUTION ALTER,A Fanciful Character Study of a Feminist And a Madman who must Find a Explorer in A Baloon Factory,1,
292,EXCITEMENT EVE,A Brilliant Documentary of a Monkey And a Car who must Conquer a Crocodile in A Shark Tank,1,
293,EXORCIST STING,A Touching Drama of a Dog And a Sumo Wrestler who must Conquer a Mad Scientist in Berlin,1,
294,EXPECATIONS NATURAL,A Amazing Drama of a Butler And a Husband who must Reach a A Shark in A U-Boat,1,
295,EXPENDABLE STALLION,A Amazing Character Study of a Mad Cow And a Squirrel who must Discover a Hunter in A U-Boat,1,
296,EXPRESS LONELY,A Boring Drama of a Astronaut And a Boat who must Face a Boat in California,1,
297,EXTRAORDINARY CONQUERER,A Stunning Story of a Dog And a Feminist who must Face a Forensic Psychologist in Berlin,1,
298,EYES DRIVING,A Thrilling Story of a Cat And a Waitress who must Fight a Explorer in The Outback,1,
299,FACTORY DRAGON,A Action-Packed Saga of a Teacher And a Frisbee who must Escape a Lumberjack in The Sahara Desert,1,
300,FALCON VOLUME,A Fateful Saga of a Sumo Wrestler And a Hunter who must Redeem a A Shark in New Orleans,1,
