film_id,title,description,language_id,original_language_id
301,FAMILY SWEET,A Epic Documentary of a Teacher And a Boy who must Escape a Woman in Berlin,1,
302,FANTASIA PARK,A Thoughtful Documentary of a Mad Scientist And a A Shark who must Outrace a Feminist in Australia,1,
303,FANTASY TROOPERS,A Touching Saga of a Teacher And a Monkey who must Overcome a Secret Agent in A MySQL Convention,1,
304,FARGO GANDHI,A Thrilling Reflection of a Pastry Chef And a Crocodile who must Reach a Teacher in The Outback,1,
305,FATAL HAUNTED,A Beautiful Drama of a Student And a Secret Agent who must Confront a Dentist in Ancient Japan,1,
306,FEATHERS METAL,A Thoughtful Yarn of a Monkey And a Teacher who must Find a Dog in Australia,1,
307,FELLOWSHIP AUTUMN,A Lacklusture Reflection of a Dentist And a Hunter who must Meet a Teacher in A Baloon,1,
308,FERRIS MOTHER,A Touching Display of a Frisbee And a Frisbee who must Kill a Girl in The Gulf of Mexico,1,
309,FEUD FROGMEN,A Brilliant Reflection of a Database Administrator And a Mad Cow who must Chase a Woman in The Canadian Rockies,1,
310,FEVER EMPIRE,A Insightful Panorama of a Cat And a Boat who must Defeat a Boat in The Gulf of Mexico,1,
311,FICTION CHRISTMAS,A Emotional Yarn of a A Shark And a Student who must Battle a Robot in An Abandoned Mine Shaft,1,
312,FIDDLER LOST,A Boring Tale of a Squirrel And a Dog who must Challenge a Madman in The Gulf of Mexico,1,
313,FIDELITY DEVIL,A Awe-Inspiring Drama of a Technical Writer And a Composer who must Reach a Pastry Chef in A U-Boat,1,
314,FIGHT JAWBREAKER,A Intrepid Panorama of a Womanizer And a Girl who must Escape a Girl in A Manhattan Penthouse,1,
315,FINDING ANACONDA,A Fateful Tale of a Database Administrator And a Girl who must Battle a Squirrel in New Orleans,1,
316,FIRE WOLVES,A Intrepid Documentary of a Frisbee And a Dog who must Outrace a Lumberjack in Nigeria,1,
317,FIREBALL PHILADELPHIA,A Amazing Yarn of a Dentist And a A Shark who must Vanquish a Madman in An Abandoned Mine Shaft,1,
318,FIREHOUSE VIETNAM,A Awe-Inspiring Character Study of a Boat And a Boy who must Kill a Pastry Chef in The Sahara Desert,1,
319,FISH OPUS,A Touching Display of a Feminist And a Girl who must Confront a Astronaut in Australia,1,
320,FLAMINGOS CONNECTICUT,A Fast-Paced Reflection of a Composer And a Composer who must Meet a Cat in The Sahara Desert,1,
321,FLASH WARS,A Astounding Saga of a Moose And a Pastry Chef who must Chase a Student in The Gulf of Mexico,1,
322,FLATLINERS KILLER,A Taut Display of a Secret Agent And a Waitress who must Sink a Robot in An Abandoned Mine Shaft,1,
323,FLIGHT LIES,A Stunning Character Study of a Crocodile And a Pioneer who must Pursue a Teacher in New Orleans,1,
324,FLINTSTONES HAPPINESS,A Fateful Story of a Husband And a Moose who must Vanquish a Boy in California,1,
325,FLOATS GARDEN,A Action-Packed Epistle of a Robot And a Car who must Chase a Boat in Ancient Japan,1,
326,FLYING HOOK,A Thrilling Display of a Mad Cow And a Dog who must Challenge a Frisbee in Nigeria,1,
327,FOOL MOCKINGBIRD,A Lacklusture Tale of a Crocodile And a Composer who must Defeat a Madman in A U-Boat,1,
328,FOREVER CANDIDATE,A Unbelieveable Panorama of a Technical Writer And a Man who must Pursue a Frisbee in A U-Boat,1,
329,FORREST SONS,A Thrilling Documentary of a Forensic Psychologist And a Butler who must Defeat a Explorer in A Jet Boat,1,
330,FORRESTER COMANCHEROS,A Fateful Tale of a Squirrel And a Forensic Psychologist who must Redeem a Man in Nigeria,1,
331,FORWARD TEMPLE,A Astounding Display of a Forensic Psychologist And a Mad Scientist who must Challenge a Girl in New Orleans,1,
332,FRANKENSTEIN STRANGER,A Insightful Character Study of a Feminist And a Pioneer who must Pursue a Pastry Chef in Nigeria,1,
333,FREAKY POCUS,A Fast-Paced Documentary of a Pastry Chef And a Crocodile who must Chase a Squirrel in The Gulf of Mexico,1,
334,FREDDY STORM,A Intrepid Saga of a Man And a Lumberjack who must Vanquish a Husband in The Outback,1,
335,FREEDOM CLEOPATRA,A Emotional Reflection of a Dentist And a Mad Cow who must Face a Squirrel in A Baloon,1,
336,FRENCH HOLIDAY,A Thrilling Epistle of a Dog And a Feminist who must Kill a Madman in Berlin,1,
337,FRIDA SLIPPER,A Fateful Story of a Lumberjack And a Car who must Escape a Boat in An Abandoned Mine Shaft,1,
338,FRISCO FORREST,A Beautiful Documentary of a Woman And a Pioneer who must Pursue a Mad Scientist in A Shark Tank,1,
339,FROGMEN BREAKING,A Unbelieveable Yarn of a Mad Scientist And a Cat who must Chase a Lumberjack in Australia,1,
340,FRONTIER CABIN,A Emotional Story of a Madman And a Waitress who must Battle a Teacher in An Abandoned Fun House,1,
341,FROST HEAD,A Amazing Reflection of a Lumberjack And a Cat who must Discover a Husband in A MySQL Convention,1,
342,FUGITIVE MAGUIRE,A Taut Epistle of a Feminist And a Sumo Wrestler who must Battle a Crocodile in Australia,1,
343,FULL FLATLINERS,A Beautiful Documentary of a Astronaut And a Moose who must Pursue a Monkey in A Shark Tank,1,
344,FURY MURDER,A Lacklusture Reflection of a Boat And a Forensic Psychologist who must Fight a Waitress in A Monastery,1,
345,GABLES METROPOLIS,A Fateful Display of a Cat And a Pioneer who must Challenge a Pastry Chef in A Baloon Factory,1,
346,GALAXY SWEETHEARTS,A Emotional Reflection of a Womanizer And a Pioneer who must Face a Squirrel in Berlin,1,
347,GAMES BOWFINGER,A Astounding Documentary of a Butler And a Explorer who must Challenge a Butler in A Monastery,1,
348,GANDHI KWAI,A Thoughtful Display of a Mad Scientist And a Secret Agent who must Chase a Boat in Berlin,1,
349,GANGS PRIDE,A Taut Character Study of a Woman And a A Shark who must Confront a Frisbee in Berlin,1,
350,GARDEN ISLAND,A Unbelieveable Character Study of a Womanizer And a Madman who must Reach a Man in The Outback,1,
351,GASLIGHT CRUSADE,A Amazing Epistle of a Boy And a Astronaut who must Redeem a Man in The Gulf of Mexico,1,
352,GATHERING CALENDAR,A Intrepid Tale of a Pioneer And a Moose who must Conquer a Frisbee in A MySQL Convention,1,
353,GENTLEMEN STAGE,A Awe-Inspiring Reflection of a Monkey And a Student who must Overcome a Dentist in The First Manned Space Station,1,
354,GHOST GROUNDHOG,A Brilliant Panorama of a Madman And a Composer who must Succumb a Car in Ancient India,1,
355,GHOSTBUSTERS ELF,A Thoughtful Epistle of a Dog And a Feminist who must Chase a Composer in Berlin,1,
356,GIANT TROOPERS,A Fateful Display of a Feminist And a Monkey who must Vanquish a Monkey in The Canadian Rockies,1,
357,GILBERT PELICAN,A Fateful Tale of a Man And a Feminist who must Conquer a Crocodile in A Manhattan Penthouse,1,
358,GILMORE BOILED,A Unbelieveable Documentary of a Boat And a Husband who must Succumb a Student in A U-Boat,1,
359,GLADIATOR WESTWARD,A Astounding Reflection of a Squirrel And a Sumo Wrestler who must Sink a Dentist in Ancient Japan,1,
360,GLASS DYING,A Astounding Drama of a Frisbee And a Astronaut who must Fight a Dog in Ancient Japan,1,
361,GLEAMING JAWBREAKER,A Amazing Display of a Composer And a Forensic Psychologist who must Discover a Car in The Canadian Rockies,1,
362,GLORY TRACY,A Amazing Saga of a Woman And a Womanizer who must Discover a Cat in The First Manned Space Station,1,
363,GO PURPLE,A Fast-Paced Display of a Car And a Database Administrator who must Battle a Woman in A Baloon,1,
364,GODFATHER DIARY,A Stunning Saga of a Lumberjack And a Squirrel who must Chase a Car in The Outback,1,
365,GOLD RIVER,A Taut Documentary of a Database Administrator And a Waitress who must Reach a Mad Scientist in A Baloon Factory,1,
366,GOLDFINGER SENSIBILITY,A Insightful Drama of a Mad Scientist And a Hunter who must Defeat a Pastry Chef in New Orleans,1,
367,GOLDMINE TYCOON,A Brilliant Epistle of a Composer And a Frisbee who must Conquer a Husband in The Outback,1,
368,GONE TROUBLE,A Insightful Character Study of a Mad Cow And a Forensic Psychologist who must Conquer a A Shark in A Manhattan Penthouse,1,
369,GOODFELLAS SALUTE,A Unbelieveable Tale of a Dog And a Explorer who must Sink a Mad Cow in A Baloon Factory,1,
370,GORGEOUS BINGO,A Action-Packed Display of a Sumo Wrestler And a Car who must Overcome a Waitress in A Baloon Factory,1,
371,GOSFORD DONNIE,A Epic Panorama of a Mad Scientist And a Monkey who must Redeem a Secret Agent in Berlin,1,
372,GRACELAND DYNAMITE,A Taut Display of a Cat And a Girl who must Overcome a Database Administrator in New Orleans,1,
373,GRADUATE LORD,A Lacklusture Epistle of a Girl And a A Shark who must Meet a Mad Scientist in Ancient China,1,
374,GRAFFITI LOVE,A Unbelieveable Epistle of a Sumo Wrestler And a Hunter who must Build a Composer in Berlin,1,
375,GRAIL FRANKENSTEIN,A Unbelieveable Saga of a Teacher And a Monkey who must Fight a Girl in An Abandoned Mine Shaft,1,
376,GRAPES FURY,A Boring Yarn of a Mad Cow And a Sumo Wrestler who must Meet a Robot in Australia,1,
377,GREASE YOUTH,A Emotional Panorama of a Secret Agent And a Waitress who must Escape a Composer in Soviet Georgia,1,
378,GREATEST NORTH,A Astounding Character Study of a Secret Agent And a Robot who must Build a A Shark in Berlin,1,
379,GREEDY ROOTS,A Amazing Reflection of a A Shark And a Butler who must Chase a Hunter in The Canadian Rockies,1,
380,GREEK EVERYONE,A Stunning Display of a Butler And a Teacher who must Confront a A Shark in The First Manned Space Station,1,
381,GRINCH MASSAGE,A Intrepid Display of a Madman And a Feminist who must Pursue a Pioneer in The First Manned Space Station,1,
382,GRIT CLOCKWORK,A Thoughtful Display of a Dentist And a Squirrel who must Confront a Lumberjack in A Shark Tank,1,
383,GROOVE FICTION,A Unbelieveable Reflection of a Moose And a A Shark who must Defeat a Lumberjack in An Abandoned Mine Shaft,1,
384,GROSSE WONDERFUL,A Epic Drama of a Cat And a Explorer who must Redeem a Moose in Australia,1,
385,GROUNDHOG UNCUT,A Brilliant Panorama of a Astronaut And a Technical Writer who must Discover a Butler in A Manhattan Penthouse,1,
386,GUMP DATE,A Intrepid Yarn of a Explorer And a Student who must Kill a Husband in An Abandoned Mine Shaft,1,
387,GUN BONNIE,A Boring Display of a Sumo Wrestler And a Husband who must Build a Waitress in The Gulf of Mexico,1,
388,GUNFIGHT MOON,A Epic Reflection of a Pastry Chef And a Explorer who must Reach a Dentist in The Sahara Desert,1,
389,GUNFIGHTER MUSSOLINI,A Touching Saga of a Robot And a Boy who must Kill a Man in Ancient Japan,1,
390,GUYS FALCON,A Boring Story of a Woman And a Feminist who must Redeem a Squirrel in A U-Boat,1,
391,HALF OUTFIELD,A Epic Epistle of a Database Administrator And a Crocodile who must Face a Madman in A Jet Boat,1,
392,HALL CASSIDY,A Beautiful Panorama of a Pastry Chef And a A Shark who must Battle a Pioneer in Soviet Georgia,1,
393,HALLOWEEN NUTS,A Amazing Panorama of a Forensic Psychologist And a Technical Writer who must Fight a Dentist in A U-Boat,1,
394,HAMLET WISDOM,A Touching Reflection of a Man And a Man who must Sink a Robot in The Outback,1,
395,HANDICAP BOONDOCK,A Beautiful Display of a Pioneer And a Squirrel who must Vanquish a Sumo Wrestler in Soviet Georgia,1,
396,HANGING DEEP,A Action-Packed Yarn of a Boat And a Crocodile who must Build a Monkey in Berlin,1,
397,HANKY OCTOBER,A Boring Epistle of a Database Administrator And a Explorer who must Pursue a Madman in Soviet Georgia,1,
398,HANOVER GALAXY,A Stunning Reflection of a Girl And a Secret Agent who must Succumb a Boy in A MySQL Convention,1,
399,HAPPINESS UNITED,A Action-Packed Panorama of a Husband And a Feminist who must Meet a Forensic Psychologist in Ancient Japan,1,
400,HARDLY ROBBERS,A Emotional Character Study of a Hunter And a Car who must Kill a Woman in Berlin,1,
